{
  "backend": "serial",
  "bus_total_ms": {
    "max": 7.703526,
    "mean": 5.339126760000002,
    "min": 3.681929,
    "p95": 7.62100245,
    "p99": 7.7019535900000005,
    "p99_9": 7.703368759
  },
  "environment": {
    "amplitude_rad": 0.0,
    "baudrate": 1000000,
    "config_path": "/home/sunrise/duck_config.json",
    "config_sha256": "131a7b8fce1107b14f4727562f44f9e17324caf7fc22512ad7115911f050991b",
    "device": "/dev/ttyACM0",
    "frequency_hz": 50.0,
    "hardware_authorized": true,
    "moving_gate_authorized": false,
    "platform": "Linux-6.1.83-aarch64-with-glibc2.35",
    "python": "3.10.12",
    "realtime": {
      "affinity": [
        7
      ],
      "background_threads": [
        {
          "affinity": [
            0,
            1,
            2,
            3,
            4,
            5,
            6
          ],
          "priority": 0,
          "scheduler": 0,
          "tid": 7275
        },
        {
          "affinity": [
            0,
            1,
            2,
            3,
            4,
            5,
            6
          ],
          "priority": 0,
          "scheduler": 0,
          "tid": 7276
        },
        {
          "affinity": [
            0,
            1,
            2,
            3,
            4,
            5,
            6
          ],
          "priority": 0,
          "scheduler": 0,
          "tid": 7277
        },
        {
          "affinity": [
            0,
            1,
            2,
            3,
            4,
            5,
            6
          ],
          "priority": 0,
          "scheduler": 0,
          "tid": 7278
        },
        {
          "affinity": [
            0,
            1,
            2,
            3,
            4,
            5,
            6
          ],
          "priority": 0,
          "scheduler": 0,
          "tid": 7279
        },
        {
          "affinity": [
            0,
            1,
            2,
            3,
            4,
            5,
            6
          ],
          "priority": 0,
          "scheduler": 0,
          "tid": 7280
        },
        {
          "affinity": [
            0,
            1,
            2,
            3,
            4,
            5,
            6
          ],
          "priority": 0,
          "scheduler": 0,
          "tid": 7281
        },
        {
          "affinity": [
            0,
            1,
            2,
            3,
            4,
            5,
            6
          ],
          "priority": 0,
          "scheduler": 0,
          "tid": 7282
        }
      ],
      "cpu": 7,
      "housekeeping_affinity": [
        0,
        1,
        2,
        3,
        4,
        5,
        6
      ],
      "initial_affinity": [
        0,
        1,
        2,
        3,
        4,
        5,
        6,
        7
      ],
      "isolated": true,
      "priority": 80,
      "scheduler": "SCHED_FIFO"
    },
    "sine_hz": 0.5,
    "sine_joint": "left_hip_yaw",
    "suspended_or_benched": true,
    "telemetry_records_dropped": 0,
    "timeout_ms": 4.0,
    "torque_enabled": false,
    "torque_off_status": "ok",
    "watchdog_consecutive_failures": 2
  },
  "extended_round_trip_ms": {
    "max": 1.316587,
    "mean": 0.8326176599999999,
    "min": 0.542586,
    "p95": 1.29079355,
    "p99": 1.3100543199999999,
    "p99_9": 1.315933732
  },
  "gates": {
    "authorization_provenance": true,
    "bus_max_under_5_ms": false,
    "complete_record_stream": true,
    "gate2_home_hold_candidate": false,
    "gate4_sine_candidate": false,
    "moving_gate_scope": false,
    "realtime_verified_when_required": true,
    "tick_p99_9_at_most_22_ms": true,
    "tick_p99_at_most_21_ms": true,
    "torque_off_confirmed": true,
    "tracking_p95_at_most_0_011_rad": false,
    "transaction_failure_below_0_1_percent": false,
    "zero_read_bursts": true
  },
  "group_round_trip_ms": {
    "max": 4.811266,
    "mean": 3.4774323799999998,
    "min": 2.581759,
    "p95": 4.71694465,
    "p99": 4.81002042,
    "p99_9": 4.811141442
  },
  "halt_reason": null,
  "hardware_gate_status": "REVIEW_REQUIRED",
  "informational_only": false,
  "jsonl_sha256": "8c6670e2b5555316ceaa27c1b5471b02b2585a7952a5da9910c8106e97dc72a6",
  "max_read_burst_ticks": 1,
  "partial_byte_count": 0,
  "read_burst_count": 0,
  "release_lateness_ms": {
    "max": 0.10253,
    "mean": 0.041656,
    "min": 0.000963,
    "p95": 0.10166069999999999,
    "p99": 0.1024075,
    "p99_9": 0.10251775
  },
  "review_status": "REVIEW_REQUIRED",
  "run_status": "COMPLETE",
  "schema_version": "open_duck_x5.timing_summary.v2",
  "tick_period_ms": {
    "max": 20.101317,
    "mean": 20.001769591836734,
    "min": 19.900025,
    "p95": 20.0984498,
    "p99": 20.10121668,
    "p99_9": 20.101306968000003
  },
  "ticks": 50,
  "ticks_requested": 50,
  "tracking_absolute_error_rad": {
    "max": null,
    "mean": null,
    "min": null,
    "p95": null,
    "p99": null,
    "p99_9": null,
    "samples": 0
  },
  "tracking_joint_index": 0,
  "transaction_failure_counts": {
    "crc": 0,
    "device": 1,
    "io": 0,
    "partial": 0,
    "timeout": 0,
    "unexpected_id": 0,
    "unexpected_packet": 0
  },
  "transaction_failure_percent": 0.125,
  "transaction_failure_rate": 0.00125,
  "transaction_status_counts": {
    "crc": 0,
    "device": 1,
    "io": 0,
    "ok": 799,
    "partial": 0,
    "timeout": 0,
    "unexpected_id": 0
  },
  "transactions_expected": 800,
  "transactions_failed": 1,
  "unexpected_packet_count": 0
}
